EDCS-ID	publication	province	place	dating_from	dating_to	date_not_before	date_not_after	status	inscription	inscription_conservative_cleaning	inscription_interpretive_cleaning	material	comment	latitude	longitude	language	photo	partner_link	extra_text	extra_html	raw_dating
EDCS-02000026	AE 1904, 00117	Africa proconsularis	Dougga / Thugga					tituli sacri	[Con]cordiae A[ug(ustae)] / sacrum / [p]agus et civitas Thu[gg(ensium)] / p(ecunia) p(ublica)	cordiae A sacrum agus et civitas Thu p p	Concordiae Augustae sacrum pagus et civitas Thuggensium pecunia publica			36.4234669	9.21869726			http://db.edcs.eu/epigr/partner.php?s_language=en&param=HD033312;1ae1904-29			
EDCS-02000027	AE 1904, 00118	Africa proconsularis	Dougga / Thugga	180	192	180	192	mulieres;  ordo decurionum;  sacerdotes pagani;  tituli operum;  tituli sacri;  tria nomina;  viri	[Q(uintus) Pacuvius Saturus fl(amen) perp(etuus) augur c(oloniae) I(uliae) K(arthaginis) et Nahania Victoria fl(aminica) perp(etua) opu]s templi Mercuri quo<d=T> M(arcus) Pacuvius Felix Victorianus filius eorum codicillis suis ex HS L mil(ibus) fieri iussit amplius ipsi ob honorem f[lamonii perpetui(?)] / [3]ae ex(s)truxerunt et excoluerunt item civitati Thugg(ensi) HS XXV m(ilia) Q(uintus) Pacuvius Saturus fl(amen) perp(etuus) daturum se pollicitus est ex cuius summae reditu quotannis decurionibu[s sportulae darentur]	s templi Mercuri quoT M Pacuvius Felix Victorianus filius eorum codicillis suis ex HS L mil fieri iussit amplius ipsi ob honorem f ae extruxerunt et excoluerunt item civitati Thugg HS XXV m Q Pacuvius Saturus fl perp daturum se pollicitus est ex cuius summae reditu quotannis decurionibu	Quintus Pacuvius Saturus flamen perpetuus augur coloniae Iuliae Karthaginis et Nahania Victoria flaminica perpetua opus templi Mercuri quod Marcus Pacuvius Felix Victorianus filius eorum codicillis suis ex HS L milibus fieri iussit amplius ipsi ob honorem flamonii perpetui ae exstruxerunt et excoluerunt item civitati Thuggensi HS XXV milia Quintus Pacuvius Saturus flamen perpetuus daturum se pollicitus est ex cuius summae reditu quotannis decurionibus sportulae darentur	lapis		36.4234669	9.21869726		http://db.edcs.eu/epigr/bilder.php?bilder.php?s_language=en&bild=$AE_1904_00118_1.jpg;$AE_1904_00118_2.jpg;$AE_1904_00118_3.jpg;$AE_1904_00118_4.jpg;$AE_1904_00118_5.jpg	http://db.edcs.eu/epigr/partner.php?s_language=en&param=HD033315;1ae1904-29;1ae1904-30			180 to 192
EDCS-02000017	AE 1905, 00018	Africa proconsularis	Dougga / Thugga					nomen singulare;  viri	[Th]eodosii f/uis debita	eodosii fuis debita	Theodosii fuis debita	lapis		36.4234669	9.21869726			http://db.edcs.eu/epigr/partner.php?s_language=en&param=HD030093;1ae1905-06			
EDCS-02000020	AE 1905, 00021	Africa proconsularis	Dougga / Thugga					tituli sacri	Deo Soli Aug(usto)	Deo Soli Aug	Deo Soli Augusto			36.4234669	9.21869726			http://db.edcs.eu/epigr/partner.php?s_language=en&param=HD030102;1ae1905-07			
EDCS-02000021	AE 1905, 00022	Africa proconsularis	Dougga / Thugga					mulieres;  nomen singulare;  tituli sepulcrales;  tria nomina;  viri	D(is) M(anibus) s(acrum) / Namphamina / Crispi Sileni filia / p(ia) v(ixit) an(nos) LXVII / h(ic) s(ita) e(st)	D M s Namphamina Crispi Sileni filia p v an LXVII h s e	Dis Manibus sacrum Namphamina Crispi Sileni filia pia vixit annos LXVII hic sita est			36.4234669	9.21869726			http://db.edcs.eu/epigr/partner.php?s_language=en&param=HD030105;1ae1905-07			
EDCS-02000033	AE 1907, 00173 = AE 2014, +01524	Africa proconsularis	Dougga / Thugga					Augusti/Augustae;  termini;  viri	Caes(aris) n(ostri) / S() F() R() G()	Caes n S F R G	Caesaris nostri S F R G	lapis		36.4234669	9.21869726			http://db.edcs.eu/epigr/partner.php?s_language=en&param=HD023804;1ae1907-48;1ae1907-49			
EDCS-16300021	AE 1914, 00167	Africa proconsularis	Dougga / Thugga					mulieres;  sacerdotes pagani;  tituli operum;  tria nomina;  viri	Q(uintus) Pacuvius Saturus fl(amen) perp(etuus) augur c(oloniae) I(uliae) K(arthaginis) e[t] Nahania [Victo]ria fl(aminica) perp(etua) a[3] / [3] omnique cultum ampliata pecunia fecerunt item porticum et [area]m macelli pago patr[i	Q Pacuvius Saturus fl perp augur c I K e Nahania ria fl perp a omni que cultum ampliata pecunia fecerunt item porticum et m macelli pago patri	Quintus Pacuvius Saturus flamen perpetuus augur coloniae Iuliae Karthaginis et Nahania Victoria flaminica perpetua a omni que cultum ampliata pecunia fecerunt item porticum et aream macelli pago patri	lapis		36.4234669	9.21869726		http://db.edcs.eu/epigr/bilder.php?bilder.php?s_language=en&bild=$AE_1914_00167.jpg;$AE_1914_00167_1.jpg;$AE_1914_00167_2.jpg;$AE_1914_00167_3.jpg;$AE_1914_00167_4.jpg	http://db.edcs.eu/epigr/partner.php?s_language=en&param=HD021314;1ae1914-35;1ae1914-36			
EDCS-16300016	AE 1914, 00174	Africa proconsularis	Dougga / Thugga					Augusti/Augustae;  tituli honorarii;  tituli sacri;  viri	Imp(eratori) Caes(ari) divi Ha/driani f(ilio) divi Traia/ni Parthici nepoti / divi Nervae pronepo/ti T(ito) Aelio Hadriano / Antonino Aug(usto) Pio tri/buniciae pot(estatis) co(n)s(uli) desig/nato II pagus et civi/tas Thugg(ensis) d(ecreto) d(ecurionum) p(ecunia) p(ublica)	Imp Caes divi Hadriani f divi Traiani Parthici nepoti divi Nervae pronepoti T Aelio Hadriano Antonino Aug Pio tribuniciae pot cos designato II pagus et civitas Thugg d d p p	Imperatori Caesari divi Hadriani filio divi Traiani Parthici nepoti divi Nervae pronepoti Tito Aelio Hadriano Antonino Augusto Pio tribuniciae potestatis consuli designato II pagus et civitas Thuggensis decreto decurionum pecunia publica	lapis		36.4234669	9.21869726		http://db.edcs.eu/epigr/bilder.php?bilder.php?s_language=en&bild=$JL_EDCS-16300016.jpg;$AE_1914_00174.jpg;$AE_1914_00174_1.jpg;$AE_1914_00174_2.jpg	http://db.edcs.eu/epigr/partner.php?s_language=en&param=HD021323;1ae1914-36;1ae1914-37			
EDCS-02000041	AE 1914, 00186	Africa proconsularis	Dougga / Thugga					tituli sacri	[C]ereri Prata[riae]	ereri Prata	Cereri Pratariae	lapis		36.4234669	9.21869726			http://db.edcs.eu/epigr/partner.php?s_language=en&param=HD021371;1ae1914-40			
EDCS-02000004	AE 1915, 00073	Africa proconsularis	Dougga / Thugga					mulieres;  tituli operum;  tituli sepulcrales;  tria nomina;  viri	Dis est sacratus Manibus / hic tumulus / qui tegit ossa piae / C[3]ae Numisiae / Marcell[in]ae Quinti / [3]O[3]RIS / quorum quo<d=T> sic sunt / coniuncta sepulcra / testantur quam concor/des exegerint aev<u=O>m / quos nec mors potuit / seiungere longe / crudelis quae sola potest / disiungere amantes	Dis est sacratus Manibus hic tumulus qui tegit ossa piae C ae Numisiae Marcell ae Quinti O RIS quorum quoT sic sunt coniuncta sepulcra testantur quam concordes exegerint aevOm quos nec mors potuit seiungere longe crudelis quae sola potest disiungere amantes	Dis est sacratus Manibus hic tumulus qui tegit ossa piae C ae Numisiae Marcellinae Quinti O RIS quorum quod sic sunt coniuncta sepulcra testantur quam concordes exegerint aevum quos nec mors potuit seiungere longe crudelis quae sola potest disiungere amantes	lapis		36.4234669	9.21869726			http://db.edcs.eu/epigr/partner.php?s_language=en&param=HD029379;1ae1915-18			
EDCS-02000037	AE 1950, 00179	Africa proconsularis	Dougga / Thugga					nomen singulare	Pantarc(h)us / Aureus / Terdiacus / Mapraeron	Pantarcus Aureus Terdiacus Mapraeron	Pantarchus Aureus Terdiacus Mapraeron	musivum	equus	36.4234669	9.21869726			http://db.edcs.eu/epigr/partner.php?s_language=en&param=HD022015;1ae1950-61			
EDCS-02000039	AE 1968, 00584 = AE 2016, +01901 = Aounallah-2016, p 194	Africa proconsularis	Dougga / Thugga	166	169	166	169	tituli sacri	M[inervae(?)] / A[ug(ustae) sacr(um)] / pa[gus et civitas] / Thu[gg(ensis) d(ecreto) d(ecurionum) p(ecunia) p(ublica)]	M A pa Thu	Minervae Augustae sacrum pagus et civitas Thuggensis decreto decurionum pecunia publica	lapis		36.4234669	9.21869726			http://db.edcs.eu/epigr/partner.php?s_language=en&param=HD015683			166 to 169
EDCS-02000040	AE 1968, 00585 = AE 2016, 01902 = Aounallah-2016, p 208 = ChrAM-2022-576	Africa proconsularis	Dougga / Thugga	157	158	157	158	Augusti/Augustae;  tituli honorarii;  tituli operum;  tria nomina;  viri	[Imp(eratori) Caes(ari) T(ito) Aelio Hadr]iano Antonino / [Aug(usto) Pio pont(ifici) max(imo) tr(ibunicia) p]ot(estate) XX imp(eratori) III co(n)s(uli) IIII p(atri) p(atriae) / [ex testamento L(uci?) Mag]ni Primi Seiani qui / [HS 3 civit(ati) Thugg]ensi lega(vi)sset ut ex / [hac summa statuam d]omino Imp(eratori) poneret / [3 ex] HS DC n(ummum) Q(uintus) H[edius(?)] / [Rufus Lollianus(?) leg(atus) p]ro pr(aetore) dedicavit	iano Antonino ot XX imp III cos IIII p p ni Primi Seiani qui ensi legasset ut ex omino Imp poneret HS DC n Q H ro pr dedicavit	Imperatori Caesari Tito Aelio Hadriano Antonino Augusto Pio pontifici maximo tribunicia potestate XX imperatori III consuli IIII patri patriae ex testamento Luci Magni Primi Seiani qui HS civitati Thuggensi legavisset ut ex hac summa statuam domino Imperatori poneret ex HS DC nummum Quintus Hedius Rufus Lollianus legatus pro praetore dedicavit	lapis		36.4234669	9.21869726			http://db.edcs.eu/epigr/partner.php?s_language=en&param=HD015686			157 to 158
EDCS-02000008	AE 1969/70, 00655 = MAD 01011 = AntAfr-1973-133	Africa proconsularis	Dougga / Thugga	1	100	1	100	mulieres;  nomen singulare;  servi/servae;  tituli sepulcrales;  tria nomina	Prote / M(arci) Licini / Rufi p(ia) vix(it) / ann(os) XXVII	Prote M Licini Rufi p vix ann XXVII	Prote Marci Licini Rufi pia vixit annos XXVII			36.4234669	9.21869726		http://db.edcs.eu/epigr/bilder.php?bilder.php?s_language=en&bild=$AE_1969_70_00655.jpg	http://db.edcs.eu/epigr/partner.php?s_language=en&param=G120100201209;HD012469			1 to 100
EDCS-09701233	AE 1969/70, 00656	Africa proconsularis	Dougga / Thugga					Augusti/Augustae;  tituli sacri	Gen[io do]/mus Aug(ustae) / sacrum	Gen mus Aug sacrum	Genio domus Augustae sacrum	lapis		36.4234669	9.21869726			http://db.edcs.eu/epigr/partner.php?s_language=en&param=HD012472			
EDCS-02000002	AE 1985, 00868	Africa proconsularis	Dougga / Thugga	210	212	210	212	Augusti/Augustae;  tituli honorarii;  tituli sacri;  viri	Imp(eratori) Ca[es(ari) L(ucio) Septimio Severo Pio Pertinaci Aug(usto)] / Arab(ico) Ad[iab(enico) Parth(ico) max(imo) Brit(annico) max(imo) pont(ifici) max(imo)] / divi M(arci) An[tonini Pii Germ(anici) Sarm(atici) fil(io)	Imp Ca Arab Ad divi M Antonini Pii Germ Sarm fil	Imperatori Caesari Lucio Septimio Severo Pio Pertinaci Augusto Arabico Adiabenico Parthico maximo Britannico maximo pontifici maximo divi Marci Antonini Pii Germanici Sarmatici filio	lapis		36.4234669	9.21869726			http://db.edcs.eu/epigr/partner.php?s_language=en&param=HD003033			210 to 212
EDCS-02000006	AE 1986, 00719	Africa proconsularis	Dougga / Thugga					nomen singulare;  viri	Et hic et ubique / sunt Florenti	Et hic et ubi que sunt Florenti	Et hic et ubi que sunt Florenti			36.4234669	9.21869726			http://db.edcs.eu/epigr/partner.php?s_language=en&param=HD008163			
EDCS-11600228	AE 1997, 01650 = AE 2016, +01901 = Aounallah-2016, p 468	Africa proconsularis	Dougga / Thugga	71	100	71	100	nomen singulare;  sacerdotes pagani;  tituli honorarii;  viri	[Faustino(?)] Felicis / Sidiathonis filio / flam(ini) Aug(usti) perp(etuo) / civitas Thuggensis / ob meritum	Felicis Sidiathonis filio flam Aug perp civitas Thuggensis ob meritum	Faustino Felicis Sidiathonis filio flamini Augusti perpetuo civitas Thuggensis ob meritum	lapis		36.4234669	9.21869726		http://db.edcs.eu/epigr/bilder.php?bilder.php?s_language=en&bild=$AE_1997_01650.jpg	http://db.edcs.eu/epigr/partner.php?s_language=en&param=HD049925			71 to 100
EDCS-11600230	AE 1997, 01652 = AE 2016, +01901 = Aounallah-2016, p 469	Africa proconsularis	Dougga / Thugga	101	130	101	130	nomen singulare;  tituli honorarii;  tria nomina;  viri	[L(ucio?)] Calp[u]rni[o] Feli/ci civitas Thug/gensis ob merita / et ipsius et patris / eius Faustini cu/ratoribus Iulio Ro/gato Mucio Kapitone	Calp rni Felici civitas Thuggensis ob merita et ipsius et patris eius Faustini curatoribus Iulio Rogato Mucio Kapitone	Lucio Calpurnio Felici civitas Thuggensis ob merita et ipsius et patris eius Faustini curatoribus Iulio Rogato Mucio Kapitone	lapis		36.4234669	9.21869726		http://db.edcs.eu/epigr/bilder.php?bilder.php?s_language=en&bild=$AE_1997_01652.jpg	http://db.edcs.eu/epigr/partner.php?s_language=en&param=HD049927			101 to 130
EDCS-11600231	AE 1997, 01653 = AE 2016, +01901 = Aounallah-2016, p 469	Africa proconsularis	Dougga / Thugga	101	130	101	130	nomen singulare;  tituli honorarii;  tria nomina;  viri	M(arco) C[alpur]nio / Fau[stino ci]vitas / Th[uggensis] patro/no o[b multa] merita / et ip[sius et pat]ris eius / Faus[tini curat]oribus / Iulio R[ogato Mu]cio Kapi/[tone]	M C nio Fau vitas Th patrono o merita et ip ris eius Faus oribus Iulio R cio Kapi	Marco Calpurnio Faustino civitas Thuggensis patrono ob multa merita et ipsius et patris eius Faustini curatoribus Iulio Rogato Mucio Kapitone	lapis		36.4234669	9.21869726		http://db.edcs.eu/epigr/bilder.php?bilder.php?s_language=en&bild=$AE_1997_01653.jpg	http://db.edcs.eu/epigr/partner.php?s_language=en&param=HD049928			101 to 130
EDCS-11600235	AE 1997, 01658	Africa proconsularis	Dougga / Thugga	31	70	31	70	tituli sacri;  tria nomina;  viri	Mercurio / Aug(usto) sac(rum) / L(ucius) Liconiu[s] / Rogati[anus] / [	Mercurio Aug sac L Liconiu Rogati	Mercurio Augusto sacrum Lucius Liconius Rogatianus	lapis		36.4234669	9.21869726			http://db.edcs.eu/epigr/partner.php?s_language=en&param=HD049933			31 to 70
EDCS-11600236	AE 1997, 01659 = Dougga-01, p 060 = AE 2005, +01686	Africa proconsularis	Dougga / Thugga					tituli sacri	Apollin[i] / Au[g(usto)]	Apollin Au	Apollini Augusto	lapis		36.4234669	9.21869726			http://db.edcs.eu/epigr/partner.php?s_language=en&param=HD049934			
EDCS-11600237	AE 1997, 01660 = Dougga-01, p 060 = AE 2005, +01686	Africa proconsularis	Dougga / Thugga					tituli sacri	Libero Patri / Aug(usto)	Libero Patri Aug	Libero Patri Augusto	lapis		36.4234669	9.21869726			http://db.edcs.eu/epigr/partner.php?s_language=en&param=HD049935			
EDCS-11600238	AE 1997, 01661 = Dougga-01, p 060 = AE 2005, +01686	Africa proconsularis	Dougga / Thugga					tituli sacri	Mercurio / Aug(usto)	Mercurio Aug	Mercurio Augusto	lapis		36.4234669	9.21869726			http://db.edcs.eu/epigr/partner.php?s_language=en&param=HD049938			
EDCS-11600239	AE 1997, 01662 = Dougga-01, p 060 = AE 2005, +01686	Africa proconsularis	Dougga / Thugga					tituli sacri	Neptuno / Aug(usto)	Neptuno Aug	Neptuno Augusto	lapis		36.4234669	9.21869726			http://db.edcs.eu/epigr/partner.php?s_language=en&param=HD049939			
EDCS-67500047	AE 2012, 01891	Africa proconsularis	Dougga / Thugga					inscriptiones christianae;  nomen singulare;  viri	Clarentius / fidelis in pace / vixit annis II / m(en)s(e) I	Clarentius fidelis in pace vixit annis II ms I	Clarentius fidelis in pace vixit annis II mense I	lapis		36.4234669	9.21869726						
EDCS-67500048	AE 2012, 01892	Africa proconsularis	Dougga / Thugga					inscriptiones christianae;  mulieres;  nomen singulare;  viri	Victorianus / vixit in pace / annis XVIII / Cattosa vi/xit in pace / annis VII	Victorianus vixit in pace annis XVIII Cattosa vixit in pace annis VII	Victorianus vixit in pace annis XVIII Cattosa vixit in pace annis VII	lapis		36.4234669	9.21869726						
EDCS-67500049	AE 2012, 01893	Africa proconsularis	Dougga / Thugga					inscriptiones christianae;  nomen singulare;  sacerdotes christiani;  tituli sepulcrales;  viri	XVIII d(ie) Kal(endas) Sep/temb(res) // Crescenti s(an)ct(i) p(res)b(yteri) / corpus digne in / s(a)eculo con<v=B>er/satum in hoc loco / in pace constat esse humatu(m)	XVIII d Kal Septemb Crescenti sct pb corpus digne in seculo conBersatum in hoc loco in pace constat esse humatu	XVIII die Kalendas Septembres Crescenti sancti presbyteri corpus digne in saeculo conversatum in hoc loco in pace constat esse humatum	lapis		36.4234669	9.21869726						
EDCS-75300352	AE 2016, 01904 = Aounallah-2016, p 247	Africa proconsularis	Dougga / Thugga	14	37	14	37	tria nomina;  viri	Tiberius / Claudius	Tiberius Claudius	Tiberius Claudius	lapis		36.4234669	9.21869726		http://db.edcs.eu/epigr/bilder.php?bilder.php?s_language=en&bild=$AE_2016_01904.jpg				14 to 37
EDCS-75300353	AE 2016, 01907 = Aounallah-2016, p 520	Africa proconsularis	Dougga / Thugga	117	138	117	138	Augusti/Augustae;  ordo equester;  sacerdotes pagani;  tituli honorarii;  tituli sacri;  tria nomina;  viri	[A(ulo) G]abinio A(uli) f(ilio) Arn(ensi) / Dato flam(ini) divi Titi in / quinque decuriis ab / Imp(eratore) Caesare Traiano / Hadriano Aug(usto) adlecto / patrono pagi et civita(tis) / pa[gu]s et civitas Thugg(ensis) [s]ua pecunia posuit	abinio A f Arn Dato flam divi Titi in quin que decuriis ab Imp Caesare Traiano Hadriano Aug adlecto patrono pagi et civita pa s et civitas Thugg ua pecunia posuit	Aulo Gabinio Auli filio Arnensi Dato flamini divi Titi in quin que decuriis ab Imperatore Caesare Traiano Hadriano Augusto adlecto patrono pagi et civitatis pagus et civitas Thuggensis sua pecunia posuit	lapis		36.4234669	9.21869726		http://db.edcs.eu/epigr/bilder.php?bilder.php?s_language=en&bild=$AE_2016_01907_1.jpg;$AE_2016_01907_2.jpg;$AE_2016_01907_3.jpg;$AE_2016_01907_4.jpg				117 to 138
EDCS-75300354	AE 2016, 01908 = Epigraphica-2020-476 = AE 2020, +01575	Africa proconsularis	Dougga / Thugga	378	379	378	379	ordo senatorius;  tituli operum;  tria nomina;  viri	[3]rri Abenti v(iri) c(larissimi) v(ice) s(acra) i(udicantis) porticum pagi o[3] / [3 temp]lis(?) maiorem gratiam redderet gemin[is 3]	rri Abenti v c v s i porticum pagi o lis maiorem gratiam redderet gemin	rri Abenti viri clarissimi vice sacra iudicantis porticum pagi o templis maiorem gratiam redderet geminis	lapis		36.4234669	9.21869726						378 to 379
EDCS-75300355	AE 2016, 01909	Africa proconsularis	Dougga / Thugga	301	400	301	400		Omnia / tibi / felicia	Omnia tibi felicia	Omnia tibi felicia	musivum		36.4234669	9.21869726						301 to 400
EDCS-85500182	AE 2020, 01580	Africa proconsularis	Dougga / Thugga	1	200	1	200	litterae erasae;  tituli sacri;  tria nomina;  viri	[[[L(ucius) C[3]s]] / [[M(arci) f(ilius) Ce[3]us]] / [[v(otum) s(olvit) l(ibens) m(erito)]]	L C M f Ce	Lucius C s Marci filius Ce us votum solvit libens merito	lapis		36.4234669	9.21869726						1 to 200
EDCS-81700355	AntAfr-2020-221 = AE 2020, 01577	Africa proconsularis	Dougga / Thugga	131	170	131	170	tituli sepulcrales;  tria nomina;  viri	D(is) M(anibus) s(acrum) / Q(uintus) Iulius / Zabullus / p(ius) v(ixit) an(nos) / LXVI h(ic) e(st) s(itus)	D M s Q Iulius Zabullus p v an LXVI h e s	Dis Manibus sacrum Quintus Iulius Zabullus pius vixit annos LXVI hic est situs	lapis		36.4234669	9.21869726		http://db.edcs.eu/epigr/bilder.php?bilder.php?s_language=en&bild=$AntAfr-2020-121.jpg;$AntAfr-2020-121_1.jpg				131 to 170
EDCS-81700356	AntAfr-2020-225 = AE 2020, 01578	Africa proconsularis	Dougga / Thugga	171	230	171	230	mulieres;  tituli sepulcrales;  tria nomina	D(is) M(anibus) s(acrum) / Secundula / Fulvia / p(ia) v(ixit) a(nnos) LXXV	D M s Secundula Fulvia p v a LXXV	Dis Manibus sacrum Secundula Fulvia pia vixit annos LXXV	lapis		36.4234669	9.21869726		http://db.edcs.eu/epigr/bilder.php?bilder.php?s_language=en&bild=$AntAfr-2020-125.jpg				171 to 230
EDCS-79300069	Aounallah-2016, p 474,3a	Africa proconsularis	Dougga / Thugga						]A[	A	A	lapis		36.4234669	9.21869726						
EDCS-79300070	Aounallah-2016, p 474,3b	Africa proconsularis	Dougga / Thugga						]N[	N	N	lapis		36.4234669	9.21869726						
EDCS-79300068	Aounallah-2016, p 474,5a	Africa proconsularis	Dougga / Thugga						]S et I[	S et I	S et I	lapis		36.4234669	9.21869726						
EDCS-79300071	Aounallah-2016, p 474,5b	Africa proconsularis	Dougga / Thugga						]MPER[	MPER	MPER	lapis		36.4234669	9.21869726						
EDCS-79300072	Aounallah-2016, p 474,8	Africa proconsularis	Dougga / Thugga						]AR[	AR	AR	lapis		36.4234669	9.21869726						
EDCS-79300073	Aounallah-2016, p 475,10	Africa proconsularis	Dougga / Thugga						]SAR[	SAR	SAR	lapis		36.4234669	9.21869726						
EDCS-79300074	Aounallah-2016, p 475,11	Africa proconsularis	Dougga / Thugga						]ER[	ER	ER	lapis		36.4234669	9.21869726						
EDCS-79300075	Aounallah-2016, p 475,13a	Africa proconsularis	Dougga / Thugga						]ili nom[	ili nom	ili nom	lapis		36.4234669	9.21869726						
EDCS-79300076	Aounallah-2016, p 475,13b	Africa proconsularis	Dougga / Thugga						]mine[	mine	mine	lapis		36.4234669	9.21869726						
EDCS-79300077	Aounallah-2016, p 475,17	Africa proconsularis	Dougga / Thugga						]AP[	AP	AP	lapis		36.4234669	9.21869726						
EDCS-79300078	Aounallah-2016, p 475,19	Africa proconsularis	Dougga / Thugga						]TA[	TA	TA	lapis		36.4234669	9.21869726						
EDCS-79300079	Aounallah-2016, p 475,20	Africa proconsularis	Dougga / Thugga						]CAEN[	CAEN	CAEN	lapis		36.4234669	9.21869726						
EDCS-43600016	BCTH-1901-392	Africa proconsularis	Dougga / Thugga					Augusti/Augustae;  tituli honorarii;  tituli sacri;  viri	Pro salut]e Imp(eratoris) Cae[saris 3] // [3]a pecunia as[3] // [3] p(atris) p(atriae) proco(n)s(ulis) et [3] / [3]o extruxit excoluit e[	Pro salute Imp Cae a pecunia as p p procos et o extruxit excoluit e	Pro salute Imperatoris Caesaris a pecunia as patris patriae proconsulis et o extruxit excoluit e	lapis		36.4234669	9.21869726		http://db.edcs.eu/epigr/bilder.php?bilder.php?s_language=en&bild=$BCTH-1901-392.jpg				
EDCS-43600017	BCTH-1901-393	Africa proconsularis	Dougga / Thugga						]onum e ra[3] / [3]t cupat [	onum e ra t cupat	onum e ra t cupat	lapis		36.4234669	9.21869726						
EDCS-44400331	BCTH-1908-LXXIX	Africa proconsularis	Dougga / Thugga						] cadent a l/[atere tuo m]ille et de/[cem milia a de]xtris tuis / [ad te autem] non adpropi/[nquabit	cadent a l ille et de xtris tuis non adpropinquabit	cadent a latere tuo mille et decem milia a dextris tuis ad te autem non adpropinquabit	lapis		36.4234669	9.21869726						
EDCS-45900042	BCTH-1923-CLI	Africa proconsularis	Dougga / Thugga					tituli sepulcrales;  tria nomina;  viri	L(ucius) Amseus Fe[lix	L Amseus Felix	Lucius Amseus Felix	lapis		36.4234669	9.21869726						
EDCS-46100474	BCTH-1925-XXXV	Africa proconsularis	Dougga / Thugga						]F O[3] / [3]ria [	F O ria	F O ria	lapis		36.4234669	9.21869726						
EDCS-46200062	BCTH-1927-86	Africa proconsularis	Dougga / Thugga						[3] Augus[3] / [3]nus [	Augus nus	Augus nus	lapis		36.4234669	9.21869726						
EDCS-46200063	BCTH-1927-87	Africa proconsularis	Dougga / Thugga						]M[3] / [3]PMB[3]	M PMB	M PMB	lapis		36.4234669	9.21869726						
EDCS-46200064	BCTH-1927-88	Africa proconsularis	Dougga / Thugga					tituli sepulcrales	D(is) M(anibus) s(acrum) / Fortun[3] / vixit [3] / [3]XI	D M s Fortun vixit XI	Dis Manibus sacrum Fortun vixit XI	lapis		36.4234669	9.21869726						
EDCS-46200065	BCTH-1927-92	Africa proconsularis	Dougga / Thugga					tituli operum	Lacum fe[c]i[t	Lacum fe it	Lacum fecit	lapis		36.4234669	9.21869726						
EDCS-60500143	BCTH-1941/42-227	Africa proconsularis	Dougga / Thugga					tituli sepulcrales;  tria nomina;  viri	L(ucius) Ne() I()	L Ne I	Lucius Ne I	lapis		36.4234669	9.21869726						
EDCS-60500145	BCTH-1941/42-229	Africa proconsularis	Dougga / Thugga					praenomen et nomen;  tituli sepulcrales;  viri	M(arcus) Niccius	M Niccius	Marcus Niccius	lapis		36.4234669	9.21869726						
EDCS-80600010	CAM-2021-14	Africa proconsularis	Dougga / Thugga					tituli sepulcrales;  viri				lapis		36.4234669	9.21869726	PU	http://db.edcs.eu/epigr/bilder.php?bilder.php?s_language=en&bild=$CAM-2021-14.jpg				
EDCS-80600011	CAM-2021-65a	Africa proconsularis	Dougga / Thugga					mulieres;  tituli sepulcrales;  tria nomina	D(is) M(anibus) s(acrum) / Villia / Victoria / p(ia) v(ixit) a(nnos) / LXXI / h(ic) s(ita) e(st)	D M s Villia Victoria p v a LXXI h s e	Dis Manibus sacrum Villia Victoria pia vixit annos LXXI hic sita est	lapis		36.4234669	9.21869726		http://db.edcs.eu/epigr/bilder.php?bilder.php?s_language=en&bild=$CAM-2021-65a.jpg				
EDCS-80600012	CAM-2021-65b	Africa proconsularis	Dougga / Thugga					mulieres;  nomen singulare;  tituli sepulcrales	D(is) M(anibus) s(acrum) / Felicit/as p(ia) v(ixit) a(nnos) / XXIII	D M s Felicitas p v a XXIII	Dis Manibus sacrum Felicitas pia vixit annos XXIII	lapis		36.4234669	9.21869726		http://db.edcs.eu/epigr/bilder.php?bilder.php?s_language=en&bild=$CAM-2021-65b.jpg				
EDCS-15300143	CIL 08, 00604 = CIL 08, 11766	Africa proconsularis	Dougga / Thugga					Augusti/Augustae;  ordo equester;  tituli operum;  viri	] Aug(ustum?) forum [ // ]II[3]no e(gregio) v(iro) [	Aug forum II no e v	Augustum forum II no egregio viro	lapis		36.4234669	9.21869726			http://db.edcs.eu/epigr/partner.php?s_language=en&param=Z00604.htm			
EDCS-15300144	CIL 08, 00605 = CIL 08, 11767	Africa proconsularis	Dougga / Thugga					tituli operum	]VCV[ // p]ecunia publica extruct[a(?)	VCV ecunia publica extructa	VCV pecunia publica extructa	lapis		36.4234669	9.21869726			http://db.edcs.eu/epigr/partner.php?s_language=en&param=Z00604.htm			
EDCS-15300145	CIL 08, 00606 = CIL 08, 11769	Africa proconsularis	Dougga / Thugga					mulieres;  tituli sepulcrales;  tria nomina;  viri	[D(is)] M(anibus) s(acrum) / [3]na / [3]aspe / [3]atu / [3]camo / [3]pia vi / [3] ann(os) / [3]I[ // D(is) M(anibus) s(acrum) / L(ucius) Iulius / Kastus / pius vi/xit ann/is XXI	M s na aspe atu camo pia vi ann I D M s L Iulius Kastus pius vixit annis XXI	Dis Manibus sacrum na aspe atu camo pia vi annos I Dis Manibus sacrum Lucius Iulius Kastus pius vixit annis XXI	lapis		36.4234669	9.21869726			http://db.edcs.eu/epigr/partner.php?s_language=en&param=Z00607.htm			
